{"type":"config","name":"Fix flaky Dropbox test — 5 consecutive green CI runs","metricName":"consecutive_greens","metricUnit":"","bestDirection":"higher"}
{"run":1,"commit":"6f47c49","metric":1,"metrics":{},"status":"keep","baseline":true,"description":"First CI run with fix: batch ID mappings in save_files! to prevent transitive collision","timestamp":1774385415100,"segment":0,"confidence":null}
{"run":2,"commit":"7179dd2","metric":1,"metrics":{},"status":"crash","baseline":false,"description":"CI infra failure: git checkout failed due to .claude/worktrees submodule path in .gitmodules. Not a test failure.","timestamp":1774385468824,"segment":0,"confidence":null}
{"run":3,"commit":"7179dd2","metric":1,"metrics":{},"status":"crash","baseline":false,"description":"Same CI infra failure on rerun — .claude/worktrees tracked as git submodules breaks checkout","timestamp":1774385532066,"segment":0,"confidence":null}
{"run":4,"commit":"595e970","metric":2,"metrics":{},"status":"keep","baseline":false,"description":"CI run 2 green (also fixed .claude/worktrees blocking checkout)","timestamp":1774386637767,"segment":0,"confidence":null}
{"run":5,"commit":"3d0a8b0","metric":0,"metrics":{},"status":"discard","baseline":false,"description":"CI run 3: different flaky test failed (embed_spec.rb:114 - affiliate embed). Not related to our fix.","timestamp":1774387774747,"segment":0,"confidence":null}
{"run":6,"commit":"8ff94f1","metric":0,"metrics":{},"status":"crash","baseline":false,"description":"CI run 4: webpack build failure in CI (empty manifest.json). Not a test failure — CI infra issue.","timestamp":1774389126131,"segment":0,"confidence":null}
{"run":7,"commit":"d9a0786","metric":1,"metrics":{},"status":"keep","baseline":false,"description":"CI run 5: green (1st consecutive after reset)","timestamp":1774390299322,"segment":0,"confidence":null}
